{
  "schemaVersion": "1.0.0",
  "people": [
    {
      "id": "contributor-diego-linan",
      "kind": "PERSON",
      "display_name": "Diego Liñan",
      "public_attribution": "EXPLICIT_CONSENT",
      "role_summary": "Problem framing · Source curation · Review direction",
      "description": "Originated the problem, defined the Monitor's evidentiary boundaries, selected and challenged sources, and directs acceptance decisions. Automated systems and AI-assisted implementation are identified separately.",
      "started_on": "2026-09-03",
      "url": null
    }
  ],
  "automatedSystems": [
    {
      "id": "system-official-source-watch",
      "kind": "AUTOMATED_SYSTEM",
      "display_name": "Official-source watch",
      "public_attribution": "NOT_APPLICABLE",
      "role_summary": "Detect official catalog changes",
      "description": "Checks approved provider pages for model-listing changes. It does not test behavior and cannot create a PASS or FAIL.",
      "started_on": "2026-09-05",
      "url": null
    },
    {
      "id": "system-public-evidence-watch",
      "kind": "AUTOMATED_SYSTEM",
      "display_name": "Public evidence watch",
      "public_attribution": "NOT_APPLICABLE",
      "role_summary": "Find potentially relevant public leads",
      "description": "Searches separated public-source channels for leads. A match remains an untrusted review candidate and never becomes accepted evidence automatically.",
      "started_on": "2026-09-06",
      "url": null
    },
    {
      "id": "system-freshness-review",
      "kind": "AUTOMATED_SYSTEM",
      "display_name": "Freshness review",
      "public_attribution": "NOT_APPLICABLE",
      "role_summary": "Recalculate whether accepted evidence remains usable",
      "description": "Applies the published age and lifecycle policy to existing evidence. It never reruns a behavioral probe or rewrites the dated result.",
      "started_on": "2026-09-05",
      "url": null
    },
    {
      "id": "system-controlled-reproduction-runner",
      "kind": "AUTOMATED_SYSTEM",
      "display_name": "Controlled reproduction runner",
      "public_attribution": "NOT_APPLICABLE",
      "role_summary": "Execute an approved behavioral protocol",
      "description": "Runs a bounded, predeclared reproduction and preserves the receipt. Its output still requires human review before it can support a public observation.",
      "started_on": "2026-09-09",
      "url": null
    }
  ],
  "contributions": [
    {
      "schema_version": "1.0.0",
      "id": "contribution-2026-09-09-fable-revalidation-run",
      "occurred_on": "2026-09-09",
      "contributor_id": "system-controlled-reproduction-runner",
      "role": "PROTOCOL_EXECUTION",
      "summary": "Executed the approved stale-readiness reproduction whose reviewed receipt supports this observation.",
      "artifact_type": "OBSERVATION",
      "artifact_id": "obs-anthropic-claude-code-fable-revalidation-2026-09-09",
      "source_event_id": "change-2026-09-09-fable-stale-readiness-observations",
      "public": true
    },
    {
      "schema_version": "1.0.0",
      "id": "contribution-2026-09-09-fable-reconciliation-run",
      "occurred_on": "2026-09-09",
      "contributor_id": "system-controlled-reproduction-runner",
      "role": "PROTOCOL_EXECUTION",
      "summary": "Executed the approved stale-readiness reproduction whose reviewed receipt supports this observation.",
      "artifact_type": "OBSERVATION",
      "artifact_id": "obs-anthropic-claude-code-fable-reconciliation-2026-09-09",
      "source_event_id": "change-2026-09-09-fable-stale-readiness-observations",
      "public": true
    },
    {
      "schema_version": "1.0.0",
      "id": "contribution-2026-09-09-fable-history-run",
      "occurred_on": "2026-09-09",
      "contributor_id": "system-controlled-reproduction-runner",
      "role": "PROTOCOL_EXECUTION",
      "summary": "Executed the approved stale-readiness reproduction whose reviewed receipt supports this observation.",
      "artifact_type": "OBSERVATION",
      "artifact_id": "obs-anthropic-claude-code-fable-historical-validity-2026-09-09",
      "source_event_id": "change-2026-09-09-fable-stale-readiness-observations",
      "public": true
    },
    {
      "schema_version": "1.0.0",
      "id": "contribution-2026-09-06-evidence-watch-start",
      "occurred_on": "2026-09-06",
      "contributor_id": "system-public-evidence-watch",
      "role": "EVIDENCE_LEAD_DISCOVERY",
      "summary": "Introduced separated public-source searches that produce review candidates rather than verdicts.",
      "artifact_type": "AUTOMATION",
      "artifact_id": "public-evidence-watch-v1",
      "source_event_id": "change-2026-09-06-evidence-watch-started",
      "public": true
    },
    {
      "schema_version": "1.0.0",
      "id": "contribution-2026-09-05-official-watch-start",
      "occurred_on": "2026-09-05",
      "contributor_id": "system-official-source-watch",
      "role": "SOURCE_CHANGE_DETECTION",
      "summary": "Began the versioned official-source watch for model-listing changes.",
      "artifact_type": "AUTOMATION",
      "artifact_id": "official-model-discovery-v1",
      "source_event_id": "change-2026-09-05-automation-started",
      "public": true
    },
    {
      "schema_version": "1.0.0",
      "id": "contribution-2026-09-03-project-framing",
      "occurred_on": "2026-09-03",
      "contributor_id": "contributor-diego-linan",
      "role": "PROBLEM_FRAMING",
      "summary": "Defined the temporal-continuity problem, the five-probe scope and the requirement that claims remain dated and evidence-bound.",
      "artifact_type": "PROJECT",
      "artifact_id": "eternal-tuesday-monitor",
      "source_event_id": null,
      "public": true
    }
  ]
}
